{
  "name": "Impact Assessment Mensenrechten en Algoritmes",
  "urn": "urn:nl:iama:2.0",
  "version": "2.0",
  "description": "Impact Assessment Mensenrechten en Algoritmes (IAMA) versie 2. Het IAMA helpt overheidsorganisaties bij het beoordelen van de impact van algoritmes op mensenrechten en publieke waarden, voorafgaand aan de ontwikkeling of inzet van een <span class=\"aiv-definition\">algoritme<span class=\"aiv-definition-text\">Een set van regels en instructies die een computer geautomatiseerd volgt bij het maken van berekeningen om een probleem op te lossen of een vraag te beantwoorden.</span></span>.",
  "tasks": [
    {
      "task": "Inleiding – Toepassing van het IAMA",
      "description": "Het Impact Assessment Mensenrechten en Algoritmes ('IAMA') is een instrument voor discussie en besluitvorming. Het instrument faciliteert een interdisciplinaire dialoog door degenen die betrokken zijn bij de ontwikkeling en/of inzet van een algoritmisch systeem. Het IAMA kan worden toegepast op AI-systemen, maar ook op algoritmische systemen die geen kunstmatige intelligentie bevatten. Omwille van de leesbaarheid wordt in het IAMA de term '<span class=\"aiv-definition\">algoritme<span class=\"aiv-definition-text\">Een set van regels en instructies die een computer geautomatiseerd volgt bij het maken van berekeningen om een probleem op te lossen of een vraag te beantwoorden.</span></span>' gebruikt. Voor een verdere uitleg over deze definities kan het IAMA-toelichtingsdocument geraadpleegd worden.\n\nHet IAMA stuurt het projectteam aan om een advies te formuleren over het al dan niet inzetten van een algoritme, en over de voorwaarden waaraan die inzet zou moeten voldoen. Het IAMA is gericht op het inschatten van de impact van het algoritme op grondrechten en biedt daarnaast ruimte voor het aan bod laten komen van andere relevante aandachtspunten rondom de inzet van het algoritme, in een vroegtijdig stadium en op een gestructureerde manier. Daardoor wordt tegengegaan dat al te snel een algoritme wordt ingezet terwijl de consequenties daarvan niet goed zijn bekeken, met de daarbij behorende risico's, zoals die van onzorgvuldigheid, ineffectiviteit of inbreuk op grondrechten.\n\nAls er tijdens het doorlopen van het IAMA onduidelijkheid bestaat over de vragen of de begrippen die daarin genoemd worden, biedt het <a href=\"https://www.rijksoverheid.nl/documenten/rapporten/2026/02/16/toelichtingsdocument-impact-assessment-mensenrechten-en-algoritmes\" target=\"_blank\">IAMA-toelichtingsdocument</a> extra houvast en verdieping.\n\n<div class=\"rvo-alert rvo-alert--warning\" style=\"display: flex;\"><span class=\"utrecht-icon rvo-icon rvo-icon-waarschuwing rvo-icon--xl rvo-status-icon-waarschuwing\" role=\"img\" aria-label=\"Waarschuwing\"></span><div class=\"rvo-alert-text\">Het huidige IAMA v2 is een actualisatie van de oorspronkelijke versie. Het is gestroomlijnd op basis van gebruikersfeedback en in lijn gebracht met de vereisten vanuit artikel 27 van de Europese AI-verordening. Eerder ingevulde IAMA's (v1) hoeven niet herzien te worden.</div></div>\n",
      "id": "0",
      "is_official_id": false,
      "type": [
        "task_group"
      ],
      "repeatable": false,
      "tasks": [
        {
          "task": "Toepassingsbereik IAMA",
          "description": "Het IAMA is een grondrechtenbeoordeling voor impactvolle algoritmes en hoog-<span class=\"aiv-definition\">risico<span class=\"aiv-definition-text\">De combinatie van de kans op schade en de ernst van die schade.</span></span> AI-systemen. De Europese AI-verordening bepaalt welke AI-systemen als hoog-risico moeten worden geclassificeerd. Hiervoor gelden specifieke vereisten, waaronder een beoordeling van de gevolgen voor grondrechten (artikel 27 AI-verordening). Het IAMA is een instrument om invulling te geven aan een dergelijke grondrechtenbeoordeling. Bij de vragen in het IAMA die corresponderen met de verschillende vereisten uit artikel 27 van de AI-verordening is dat aangegeven door middel van een 'art. 27 AI-verordening'-icoontje. <svg xmlns=\"http://www.w3.org/2000/svg\" width=\"20\" height=\"20\" viewBox=\"0 0 24 24\" fill=\"none\" stroke=\"currentColor\" stroke-width=\"2\" stroke-linecap=\"round\" stroke-linejoin=\"round\" role=\"img\" aria-label=\"Dit correspondeert met een vereiste uit art. 27 van de AI Verordening\" style=\"display: inline-block; vertical-align: middle; margin-left: 0.2em;\"><title>Dit correspondeert met een vereiste uit art. 27 van de AI Verordening</title><path d=\"M16 16.01V16M8 16.01V16\"/><path d=\"m16 16 3-8\"/><path d=\"m8 16-3-8\"/><path d=\"M7 21h10\"/><path d=\"M12 3v18\"/><path d=\"M3 7h2c2 0 5-1 7-2 2 1 5 2 7 2h2\"/><path d=\"M22 8a5 5 0 0 1-6 0\"/><path d=\"M8 8a5 5 0 0 1-6 0\"/></svg>\n\nHet IAMA is ook geschikt om een grondrechtenbeoordeling te geven bij impactvolle algoritmes die niet vallen in de categorie hoog-risico AI-systemen of die buiten het bereik van de AI-verordening vallen. Een impactvol algoritme is volgens de Handreiking Algoritmeregister een algoritme met directe rechtsgevolgen voor mensen of organisaties of een algoritme dat beïnvloedt hoe de overheid een persoon of groep categoriseert.\n\nBij de inzet van generatieve AI of General Purpose AI kan de uitvoering van het IAMA in de praktijk soms moeilijk blijken. Dit zijn AI-systemen waar bijna altijd gebruik wordt gemaakt van een voorgetraind model van een externe leverancier. Hierdoor is het doorgaans onmogelijk om te weten wat de <span class=\"aiv-definition\">trainingsdata<span class=\"aiv-definition-text\">Data die worden gebruikt voor het trainen van een AI-systeem door de leerbare parameters hiervan aan te passen.</span></span> zijn, hoe de trainingsprocedure is gelopen en welke bias er in het model zit. Ook is het van belang voor het doorlopen van het IAMA dat het AI-systeem dat getoetst wordt een heldere doelbinding heeft. Dit is doorgaans moeilijker met General Purpose AI. Het <a href=\"https://www.rijksoverheid.nl/documenten/rapporten/2026/02/16/toelichtingsdocument-impact-assessment-mensenrechten-en-algoritmes\" target=\"_blank\">IAMA-toelichtingsdocument</a> biedt extra handvatten voor de toepassing van het IAMA op generatieve AI en General Purpose AI.\n",
          "id": "0.1",
          "is_official_id": false,
          "type": [
            "task_group"
          ],
          "repeatable": false
        },
        {
          "task": "Instructie",
          "description": "<strong>Vooraf</strong>\n\nDe discussie over de verschillende vragen moet plaatsvinden in een breed samengesteld team waarin mensen met verschillende specialisaties en achtergronden zitting hebben. In het team moeten in elk geval de volgende functies betrokken worden:\n  • Projectleider\n  • Data scientist\n  • Jurist\n\nHoewel bovengenoemde functies de kern beslaan van het team, is het cruciaal dat er meerdere functies betrokken worden bij dit proces. Een interdisciplinair en breed team is het uitganspunt. Voor houvast hierbij: zie de functietabel in het <a href=\"https://www.rijksoverheid.nl/documenten/rapporten/2026/02/16/toelichtingsdocument-impact-assessment-mensenrechten-en-algoritmes\" target=\"_blank\">IAMA-toelichtingsdocument</a>. Voor een soepel proces wordt aangeraden het IAMA in te vullen met een groep van 4-7 personen, die op locatie aanwezig zijn en het IAMA gezamenlijk bespreken onder leiding van een gespreksleider. Een jurist die uitzoekwerk kan doen op het gebied van grondrechten is voor deel 4 onmisbaar.\n\nVoor het invullen van het IAMA, het ophalen van de benodigde informatie en reflectie op het waarom en hoe van de inzet van het algoritme, is tijd nodig. Wees op tijd met het inplannen van de sessies voor het IAMA en doe dit niet vlak voor een opleverdeadline. Het IAMA is geen afvinklijstje, maar een instrument voor dialoog, reflectie en besluitvorming.\n\n<strong>Tijdens</strong>\n\nHet wordt sterk aangeraden het proces in verschillende bijeenkomsten op te knippen, bijvoorbeeld een sessie van twee uur voor deel 1 en 2 en een sessie van twee uur voor deel 3 en subonderdeel 4.1. Voor subonderdeel 4.2 zal een jurist hoogstwaarschijnlijk uitzoekwerk moeten verrichten. Wanneer dat is gedaan, kan een laatste sessie worden gepland van een uur voor de resterende vragen van deel 4 en de afsluiting.\n\nHet is de bedoeling om in teamverband de vragen door te nemen en de antwoorden in het IAMA-document vast te leggen. Per vraag moeten de antwoorden en de belangrijkste overwegingen en gemaakte keuzes worden vastgelegd. Als meer houvast of uitleg gewenst is bij een specifiek subonderdeel, kan het <a href=\"https://www.rijksoverheid.nl/documenten/rapporten/2026/02/16/toelichtingsdocument-impact-assessment-mensenrechten-en-algoritmes\" target=\"_blank\">IAMA-toelichtingsdocument</a> worden geraadpleegd.\n\n<strong>Na afloop</strong>\n\nHet IAMA stuurt het team aan om een advies te formuleren over het al dan niet inzetten van het algoritme, en over de voorwaarden waaraan inzet zou moeten voldoen. Dit advies kan ter goedkeuring worden voorgelegd aan de inhoudelijk of politiek verantwoordelijke(n). Deze verantwoordelijke dient eveneens te besluiten over acceptatie van eventuele restrisico's. Het ingevulde IAMA kan dienen als naslagwerk en ter verantwoording van het besluitvormingsproces rondom de ontwikkeling en de implementatie van het algoritme.\n",
          "id": "0.2",
          "is_official_id": false,
          "type": [
            "task_group"
          ],
          "repeatable": false
        },
        {
          "task": "Nadere Toelichting",